{
  "schema_version": "1.0",
  "job": {
    "id": "example-historical-web-001",
    "created_by": "local-user",
    "notes": "Public historical-person example; replace all placeholders."
  },
  "subject": {
    "person_id": "example-historical-thinker",
    "display_name": "示例历史人物",
    "kind": "historical_public",
    "aliases": [],
    "identity_anchors": {
      "active_years": "<起止年代>",
      "regions": ["<地区>"],
      "fields": ["<领域>"],
      "disambiguation_note": "<用于排除同名人物的信息>"
    }
  },
  "purpose": {
    "goals": [
      "研究其处理具体问题时使用的概念和决策方法"
    ],
    "target_capabilities": ["direct_chat", "roundtable"],
    "excluded_topics": []
  },
  "input": {
    "mode": "web",
    "web": {
      "languages": ["zh", "en"],
      "max_sources": 40,
      "seed_queries": [
        "<人物姓名> 著作 访谈 演讲 书信",
        "<人物姓名> criticism biography archive"
      ],
      "seed_urls": [],
      "allowed_domains": [],
      "blocked_domains": [],
      "prefer_primary_sources": true
    }
  },
  "privacy": {
    "local_only": false,
    "network_enabled": true,
    "remote_processing_allowed": true,
    "publish_visibility": "private",
    "redact_third_parties": true,
    "retain_raw_inputs": true
  },
  "quality": {
    "minimum_independent_sources": 10,
    "minimum_evidence_cards": 30,
    "holdout_fraction": 0.2,
    "require_human_publish_review": true
  },
  "output": {
    "personas_directory": "../../personas",
    "target_level": "chat-ready",
    "overwrite_existing": false
  }
}
